Question,Answer
"Question: How does omitting relevant variables impact regression coefficient estimates in a model?

A. Decreases measurement error  
B. Increases reliability of estimates  
C. Introduces omitted variable bias  
D. Enhances model complexity","Answer: C. Introduces omitted variable bias  

Explanation: Omitting relevant variables from a regression model introduces omitted variable bias, leading to biased coefficient estimates and potentially impacting the accuracy and interpretation of the relationships between variables in the model."
"Question: How does failures in regression functional form due to omitted variables impact statistical inference?

A. Reduces Type I errors  
B. Increases model efficiency  
C. Introduces omitted variable bias  
D. Enhances model simplicity","Answer: C. Introduces omitted variable bias  

Explanation: Failures in regression functional form due to omitted variables can introduce omitted variable bias, resulting in distorted coefficient estimates and affecting the validity and robustness of statistical inference in the model."
